{
  "schema_version": "parser_legacy_result.v1",
  "case_id": "accepted_btc_long",
  "foxclaw_core_target_commit": "18c859a",
  "generated_at": "2026-06-21T12:00:00Z",
  "runtime": {
    "machine": "A2",
    "listener_entrypoint": "trading/app/user_ingest.py",
    "canonical_listener_pid": 13624,
    "duplicate_listener_state": "single_listener_confirmed",
    "raw_events_advancing": true,
    "token_or_env_exposed": false
  },
  "parser": {
    "wrapper": "tools/raw_parser.py",
    "implementation": "src/parsers/signal_parser.py::parse_trade_signal",
    "version": "live_raw_parser_admission_v13",
    "kind": "deterministic_rule_based"
  },
  "source": {
    "source_ref_id": "source_hash_alpha",
    "source_filter_semantics": "watched_channels_and_parent_threads",
    "content_hash": "sha256:4df55f774027269656e9ee677a496838c3b4a8dede52f31b62b823faee516a4b",
    "dedupe_key": "sha256:aaaaaaaaaaaaaaaaaaaaaaaaaaaaaaaaaaaaaaaaaaaaaaaaaaaaaaaaaaaaaaaa",
    "message_ref_hash": "sha256:fixture-message-alpha-001",
    "message_id_is_lineage_only": true
  },
  "result": {
    "accepted": true,
    "reason_code": "accepted_trade_signal",
    "duplicate_disposition": "accepted_once",
    "parser_confidence": 86,
    "normalized_payload": {
      "candidate_type": "trade_signal",
      "symbol": "BTC/USD",
      "side": "long",
      "entry_price": "65000",
      "quantity": "1",
      "stop_loss": "64000",
      "take_profit": "68000"
    }
  },
  "safety": {
    "raw_content_included": false,
    "discord_ids_included": false,
    "discord_links_included": false,
    "token_values_included": false,
    "coinfox_touched": false,
    "live_execution_touched": false
  }
}
